precio,ubicacion,habitaciones,baños,parqueaderos,area,descripcion,tipo_propiedad,ciudad_final,precio_por_m2
4500000,"candelaria, laureles, conquistadores",5.0,2.0,1.0,210.0,arrienda casa uso exclusivo comercio 210 mts² aproximadamente fácil acceso salida rutas transporte público avenidas principales cerca migueria suramericana mayor informacion comunicarse kevin lopera celular camila velasquez,Casa en arriendo,bogota,21428.571428571428
9000000,"samanes de morada, solares de morada vii y viii, cr castillo herreria ii",5.0,5.0,6.0,550.0,arrienda hermosa casa condominio morada entrada jamundi campestre construcción moderna bien distribuida espacios abiertos amplios fresca iluminada seis habitaciones baño incluida servicio,Casa en arriendo,desconocida,16363.636363636364
2500000,"salado, br modelia . i, ibague",5.0,3.0,,270.0,casa nueva 10 10 lote esquinera primer piso dos locales cada baño entrada independiente escaleras segundo piso independiente baño vista luz lado escaleras independientes terraza cubierta,Casa en arriendo o venta,ibague,9259.25925925926
5500000,"loma de bernal, san bernardo, cristo rey",5.0,6.0,2.0,330.0,impresionante casa 330 m encuentra excelente ubicacion zona residencial tranquila bien conectada diseno arquitectonico aprovecha maximo luz natural brindando espacios iluminados ventilados cada rincon amplio salon principal fusiona comedor creando ambiente acogedor ideal reuniones familiares cocina moderna completamente equipada espacio funcional espacioso cuenta cuatro habitaciones todas vistas jardin armarios empotrados tres banos lujo jardin exterior ideal actividades aire libre mientras patio ofrece espacio privado relajante ademas garaje amplio varios vehiculos casa ubicada cerca parques centros comerciales colegios convierte lugar ideal disfrutar vida tranquila comoda renunciar cercania servicios,Casa en arriendo,desconocida,16666.666666666668
1900000,"dorado, centro engativa, granjas del dorado",5.0,2.0,,120.0,casa tres niveles ampliada terraza cubierta patio ropas ubicada vía peatonal barrio villas granada casa distribuida 5 habitaciones closet cuarto servicio sala comedor cocina integral 2 baños cuadra parada alimentador villas granada villa amalia rutas sitp parque principal iglesia villas granada colegios luigi pirandello católico sabana nueva constitución cerca portal transmilenio calle 80supermercado éxito occidente centró comercial unicentro occidente centró comercial portal 80hospital engativá vías acceso calle 80 72,Casa en arriendo,bogota,15833.333333333334
5500000,"laureles, san diego, rosales",5.0,2.0,,130.0,sujeto verificación disponibilidad cuentasala comedorhallcina integralalacenaspiso ceramicasolo destinación comercial1 baño cabinado acrilico espejos barra americana granito liso 2 nocheros habitaciones patio semicubierto,Casa en arriendo,bogota,42307.692307692305
3000000,"laureles, acacias, lorena",5.0,3.0,1.0,90.0,casa 5 alcobas ideal vivienda comercio ubicada reconocida zona america niza ubicacion privilegiada ofrece facil acceso excelentes rutas transporte facilitando conexion sectores ciudad cuenta amplios espacios brindan comodidad confort toda familia dispone garaje permitiendo estacionar manera segura vehiculos ademas cuenta 5 alcobas convierte opcion perfecta aquellos buscan espacio adicional dormitorios oficinas areas recreativas distribucion permite circulacion fluida optimizacion cada area adaptandose diversas necesidades duda excelente oportunidad buscan calidad vida comodidad ubicacion estrategica,Casa en arriendo,cali,33333.333333333336
5500000,"laureles, lorena, acacias",5.0,2.0,,320.0,,Casa en arriendo,medellin,17187.5
5500000,"laureles, conquistadores, castellana",5.0,3.0,0.0,280.0,arrendamos amplia versátil casa comercial belén oportunidad única buscan espacio ideal negocios actividades comerciales zonas estratégicas medellín cuenta área aproximada distribuidos sala comedor amplios cinco habitaciones espacios pueden adaptarse según necesidades negocio tres baños brindan comodidad funcionalidad cocina integral equipada mayor practicidad piso cerámica garantiza durabilidad fácil mantenimiento perfecto alto tránsito ubicada estrato 5 casa encuentra ubicación privilegiada pocas cuadras avenida nutibara avenida 30 avenida 33 entorno ofrece acceso rápido vías principales zonas comerciales bancos restaurantes tiendas d1 así excelente conectividad transporte público proceso arrendamiento puedes tranquilo totalmente virtual rápido sencillo completamente gratis gracias aseguradora libertador facilita trámite forma eficiente complicaciones si buscando espacio combine amplitud ubicación estratégica todas facilidades necesarias negocio opción ideal agenda cita hoy mismo pierdas oportunidad conocer espacio único,Casa en arriendo,medellin,19642.85714285714
3500000,"br san fernando, corregimiento cerritos, ur rincon de palma",5.0,6.0,9.0,250.0,arrienda hermosa casa campestre ubicada sector exclusivo cerritos diagonal club campestre casa cuenta 250metros construidos 5 habitaciones 4 baños sala tv sala comedor cocina integral remodelada zona ropas salon independiente conjunto cuenta piscina salon social cancha tenis cancha microfutbol cesped lago vigilancia total 7 casas lote cuenta area vista espectacular cañon rio consota divisa varias poblaciones nevados ruiz santa isabel,Casa campestre en arriendo,bogota,14000.0
5500000,"loma de bernal, san bernardo, cristo rey",5.0,6.0,2.0,330.0,casa arriendo unidad cerrada cerca via principal cerca cancha supermercados cadena restaurantes parques servicios complementarios piso porcelanato 2 niveles sala comedor independiente biblioteca 5 alcobas baño principal jacuzzi cocina integral cerrada balcon parqueaderos independientes descubierto conjunto cerrado gimnasio salon social parques infantiles placa polideportiva zonas verdes vigilancia 24 hrs circuito cerrado tvinmuebles sujetos verificación disponibilidad,Casa en arriendo,desconocida,16666.666666666668
3000000,"laureles, candelaria, conquistadores",5.0,2.0,1.0,105.0,codigo 22383 apartamento arriendo ubicado medellín sector unicentro características ✔️ área total ✔️ niveles 2 ✔️ habitaciones 5 hab principal clóset piso cerámica hab 2 clóset piso cerámica hab 3 clóset piso cerámica hab 4 clóset piso cerámica hab 5 piso cerámica ✔️ baños2 baño auxiliar piso cerámica ✔️ cocina integral cerrada cubierta gas campana extractora mesón acero inoxidable ✔️ zona ropas ✔️ salacomedor ✔️ biblioteca estudio ✔️ terraza patio ✔️ parqueadero sencillo ✔️ red gas servicios públicos ubicación entornoubicado exclusivo barrio conquistadores sector unicentro medellína pocos minutos ✨ centro comercial unicentro ✨ universidad medellín ✨ estadio atanasio girardot ✨ variada oferta comercial gastronómica ✨ excelente acceso transporte público zonas comunes portería 24 horas canon arrendamiento3200000 cop dejes pasar oportunidad vivir sector estratégico todas comodidades agenda visita hoy mismo,Apartamento en arriendo,medellin,28571.428571428572
8800000,"porvenir, centro, santa ana",5.0,5.0,2.0,380.0,380 mt construidos area total 1580 casa campestre dos niveles 5 habitaciones 5 baños sala comedor cocina integral star garaje 2 autos parqueadero aproximado 5 autos zona verde enmallada portada eléctrica cerca supermercado tienda iglesia colegios zona tranquila segura,Casa campestre en arriendo,bogota,23157.894736842107
2300000,"manizales, palermo bajo, alta suiza",5.0,3.0,0.0,100.0,casa amplia cuenta 1 nivel 5 alcobas closet cada 2 baños alcobas social sala comedor cocina sencilla pisos madera lacada cerámica calentador gas zona residencial zona comercial bien ubicada cerca centros comerciales supermercados restaurantes buen transporte publico casa comercial valor mas iva,Casa en arriendo,manizales,23000.0
15000000,"retiro, . campo, a.s.d.",5.0,15.0,2.0,390.0,casa arriendo retiro sector montebello excelente casa 1400 mtrs2 construidos distribuidos 5 habitaciones 7 baños closets balcón cocina integral salacomedor zona ropas chimenea parqueadero cuarto útil calentador zonas verdes ubicada parcelación cerca parque excelente ubicación cómodas rutas acceso amoblado 18000000 código,Casa en arriendo,bogota,38461.53846153846
30000000,"florida, altos del poblado, castropol",5.0,5.0,1.0,1500.0,codigo 20207 casa amoblada arriendo ubicada poblado sector caleracera colegio cedros colegio marymount amsterdan plazacomodidades 5 habitaciones casa cuenta terrazas 2 5 habitaciones jacuzzi turco zona bbq zona descanso chimenea 5 baños sala comedor biblioteca estudio zona ropas balcón terraza patio cocina abierta integral cubierta eléctrica campana mesón quarztone parqueadero doble lineal red gas servicios públicos,Casa en arriendo,medellin,20000.0
4000000,"ditaires, santa catalina, ancon san martin",6.0,3.0,1.0,140.0,casa arriendo estrella sector portal ditaires excelente casa contruidos distribuidos 6 habitaciones 3 baños closet estudio balcòn salacomedor cocina zona ropa garaje cuarto utìl 3 niveles excelente ubicación cómodas rutas acceso valor arriendo comercial 4000000 vivienda 3500000 codigo,Casa en arriendo,medellin,28571.428571428572
7000000,"mesa, zona centro, bosques de zuniga",6.0,6.0,3.0,275.0,casa local ubicada barrio portal cerca centro comercial viva estación envigado cerca colegios supermercados fácil acceso transporte público detrás iglesia mormones área libre,Casa en arriendo,medellin,25454.545454545456
3000000,"santa rosa de lima, colores, estadio",6.0,3.0,0.0,180.0,espectacular casa arriendo ubicado barrio calasanz parte alta ciudad medellín cuenta 6 habitaciones 3 baños 0 parqueaderos área construida 180 estrato 3,Casa en arriendo,medellin,16666.666666666668
30000000,"castropol, tesoro, alejandria",15.0,6.0,25.0,600.0,alquiler amplia casa comercial poblado buenos espacios iluminados 3 niveles 15 salones 4 sótano1 patio 1 terraza amplia 8 baños rodeada buena zona verde jardines parqueadero 25 vehículos 2 cubiertos casa sector tranquilo central poblado cerca av pobladocalle 10 zona rosa ciudad encontraremos supermercados cafés restaurantes zona bancos clínicas instituciones educativasvalor alquiler 30000000 mes,Casa en arriendo,medellin,50000.0
8500000,"santa rosa de lima, calasanz, estadio",11.0,9.0,1.0,238.0,arrienda casa local calasanz fácil acceso av 80 av colombia rutas fácil acceso adicional ubicado zona plana cerca zona comercial 80 cerca mercados madrid tiendas d1 cajeros droguerías canchas instituciones educativas restaurantes sitios interés área piso 1 cocina integral zona ropas 11 habitaciones 9 baños 1 patio amplio 1 espacio parquear adecuarlo local red gas 1 apartamento dentro misma cocina zona ropas pierdas gran oportunidad comunícate,Casa en arriendo,desconocida,35714.28571428572
1800000,"candelaria, medellin, boston",6.0,2.0,,140.0,casa arrendamiento primer piso 6 alcobas 3 closet 2 baños cocina integral 2 patios sala comedor dos cuadras comfama aranjuez,Casa en arriendo,medellin,12857.142857142857
8500000,"tesoro, castropol, alejandria",10.0,6.0,1.0,210.0,codigo 24444 casa comercial arriendo ubicada poblado sector provenzacerca variedad restaurantes provenza éxito tiendas d1 parque poblado bodytech vizcaya centro comercial vizcaya mall piaza bella transversal inferior avenida pobladocasa 2 niveles altura 3 metros amplios espacios buena ubicación zona tranquila ideal oficinascuenta puerta peatonal vigilancia cocina baños comunes baños oficina parqueaderos privados 2 pisos baldosa,Casa en arriendo,medellin,40476.19047619047
4950000,"laureles, castellana, rosales",8.0,4.0,2.0,290.0,casa local arrendar laureles ubicada cerca viva carrera 80 cuenta área distribuidos siguiente manera,Casa en arriendo,desconocida,17068.96551724138
5400000,"chapinero , samper, chapinero occidental",9.0,8.0,1.0,147.0,corazón ciudad sector marly encuentra linda casa arriendo distribución perfecta brindar comodidad privacidad habitantes ocho habitaciones cinco baños ofrece espacio amplio funcional toda familia diseñado garantizar máximo confort estadía agradable luminosidad amplio acogedor patio ubicación privilegiada casa lugar ideal crear inolvidables recuerdos ambiente agradable pierdas oportunidad vivir exclusivo hogar,Casa en arriendo,bogota,36734.69387755102
5500000,"laureles, acacias, lorena",11.0,4.0,2.0,500.0,valor comercial 7500000te presentamos hermosa casa construidos cuenta todas comodidades disfrutes vida plena 11 amplias alcobas 5 cuartos closet diseño abierto casa ofrece espacio necesitas familia amigos primer piso completamente integrado enorme sala comedor cocina gourmet equipada electrodomésticos última generación además podrás relajarte amplio balcón vista zona verde sector tonificarte completa zona entrenamiento cuenta calentador eléctrico lavandería parqueadero techado ubicada pasos mejores colegios universidades ciudad además rodeada centros comerciales restaurantes transporte público moverte comodidad,Casa en arriendo,medellin,11000.0
6500000,"laureles, rosales, acacias",7.0,2.0,0.0,166.0,arrindo casa uso comercial sector conquistadores cuadra av 33 centro comercial unicentro ideal oficina excelete espacio mas 7 habitaciones 2 baños,Casa en arriendo,medellin,39156.6265060241
12000000,"laureles, rosales, acacias",7.0,21.0,3.0,500.0,bemsa raíz espectacular casa amplia cerca iglesia santa gema excelentes espacios propia inversión idea sector comercial cuenta 6 habitaciones espacios hacer muchas mas 10 baños 3 salas amplias parqueadero doble lineal cocina cerrada turco zona bbq casa 4 niveles terraza ampliar si construcción mayor información contactar daniela orozco,Casa en arriendo,desconocida,24000.0
8000000,"altos del prado, villa santos, ciudad jardin",6.0,5.0,10.0,479.0,descubre majestuosa residencia 6 habitaciones 5 baños total elegancia confort cuenta 10 parqueaderos comodidad invitados diseño arquitectónico único amplios espacios interiores brindarán tranquilidad privacidad buscas hogar vive experiencia lujo exclusividad cada rincón impresionante casa bienvenido nuevo hogar ensueño,Casa en arriendo,desconocida,16701.461377870564
9500000,"tesoro, castropol, alejandria",6.0,4.0,2.0,186.0,apartamento alquiler area 186 metros sala comedor cocina integral red gas calentador 3 alcobas mas alcoba servicio4 baños 3 vestier tv 3 balcones piso madera 2 parquedero cuarto util porteria 24 horas shut basuras parqueadero visitantes ascensor piscina sauna gimanasio juegos infantiles,Apartamento en arriendo,medellin,51075.2688172043
4000000,"castropol, simesa, villa carlota",7.0,3.0,1.0,260.0,casa comercial arriendo medellin sector guayabal excelente casa comercial 3 pisos contruidos distribuidos 7 habitaciones alcoba servicio 3 baños closet balcón cocina patio garaje excelente ubicación cómodas rutas acceso codigo,Casa en arriendo,medellin,15384.615384615385
4000000,"balsos no.1, naranjos, esmeraldal",6.0,6.0,1.0,304.0,sujeto verificacion disponibilidad estufa gas alacenasgas pipeta 3 baños cabinados acrílico 1 vestier cuenta tres cocinas semi integrales 3 lavaderos adicionales permite subarrendar ideal hotel,Casa en arriendo,bogota,13157.894736842105
5800000,"zona centro, santa maria de angeles, diamante no.2",6.0,2.0,1.0,200.0,casa dúplex comercialvivienda arriendo envigado magnolia excelente casa duplex comercial vivienda construidos distribuidos 6 habitaciones 2 baños closet balcón terraza cocina salacomedor zona ropas cómodas rutas acceso comercial 5800000 vivienda 4800000 código,Casa en arriendo,medellin,29000.0
8000000,"candelaria, san diego, medellin",8.0,4.0,0.0,420.0,amplia casa lote arriendo brinda excelente ubicación cuadra media torres bombona podrás adelantar proyectos ambiciosos gracias cuenta permiso contruir bajo normativas municipales cuenta 8 alcobas 4 baños sala comedor piso baldosa patio cubierto anímate agenda cita,Casa en arriendo o venta,medellin,19047.619047619046
4600000,"laureles, castellana, acacias",6.0,4.0,1.0,180.0,corazón prestigioso barrio simón bolívar encuentra majestuosa residencia combina elegancia comodidad cada rincón 6 amplias habitaciones diseñadas descanso serenidad 4 closets ofrecen espacio generoso cada detalle casa refugio armonía 4 baños finamente terminados pensados ofrecer momentos relajación confort garaje asegura tranquilidad vehículo mientras encantador balcón regala vistas apacibles aire fresco entorno cocina integral equipada red gas espacio funcionalidad encuentra arte culinario patio interno invita disfrutar momentos íntimos aire libre ubicada estrato 5 combina exclusividad conveniencia área construida oportunidad única habitar espacio cada detalle cuenta historia sofisticación descúbrela,Casa en arriendo,desconocida,25555.555555555555
11000000,"rosales, chapinero , chico",9.0,6.0,2.0,315.0,nogal sectores mas exclusivos ciudad ofrecemos joya arquitectura bogotana cuenta 310m tres niveles incluidos hemoso altillo 80m primera hall entrada dos oficinas cerradas baño privado dos oficinas baño compartido espacio amplio cocina cafetería agradable terraza interior segunda planta cinco espacios cerrados tres baños casa cuenta dos garajes cubiertos encantador jardín ideal oficinas casas moda diseño centros bienestar,Casa en arriendo,bogota,34920.63492063492
5000000,"laureles, conquistadores, castellana",7.0,4.0,1.0,240.0,hermosa casa alquiler encuentra ubicado medellín antioquia área terreno área construida área privada equipada 7 alcobas 4 baños baño auxiliar 1 garaje interior cuenta citófonointercomunicador clósets cocina integral gas domiciliario trastero vista panorámica cuenta zona lavandería exterior cuenta excelentes características tales acceso pavimentado árboles frutales bosque nativos calles tosca centros comerciales cerca zona urbana parqueadero visitantes parques cercanos porteríarecepción ríoquebrada cercano vía principal transporte público cercano trastero zona industrial zona residencial zonas verdes bella casa ideal vivir medellín ofreciéndole todas comodidades necesarias bienestar ubicada mejores zonas medellín gran seguridad cercana entidades bancarias farmacias escuelas comercios casa ideal aquellos buscan lugar tranquilo seguro vivir codigo,Casa en arriendo,medellin,20833.333333333332
20000000,"chapinero , emaus, quinta camacho",8.0,6.0,2.0,386.0,presentamos arriendo funciona negocio comercial ubicado chapinero sector gran movimiento vías acceso principales trata casa esquinera cuatro pisos excelente hermoso jardín rededor estrato cuatro cuenta servicios agua luz gas internet televisión cable puede ser excelente opción inversionista actualmente está rentando oficinas temporales pueden funcionar renta mes ocupación completa uso principal casa vivienda u oficina mixta uso complementario proyectos educativos culturales permite casa banquetes licores bares hospedaje casa remodelada adecuada oficinas independientes actualmente cinco oficinas mas bodega rentada estudio rentado esperas conocer oportunidad única,Casa en arriendo,bogota,51813.47150259068
10000000,"laureles, lorena, colores",7.0,4.0,1.0,500.0,,Casa en arriendo,medellin,20000.0
18000000,"laureles, castellana, rosales",18.0,9.0,1.0,330.0,casa comercial avenida 33 cerca avenida 80 iglesia santa gema casa cuenta 17 habitaciones baño recepción sala espera terraza salón eventos gran oportunidad empresa negocio,Casa en arriendo,desconocida,54545.454545454544
12000000,"altos del prado, prado, villa country",9.0,3.0,2.0,700.0,hermosa casa comercial arriendo ubicada tradicional sector prado norte ciudad barranquilla esquina vías principales mas importantes ciudad fácil acceso transporte cerca centros comerciales almacenes cadena restaurantes colegios facilidad comunicación via 40 casa cuenta 2 niveles zona parqueo externo 7 vehículos garaje privado cubierto portón eléctrico terraza externa amplia cerramiento jardines pisos mosaico cristalizados grandes salones balcón terraza grande segundo nivel 3 baños modernos cocina mezzanine patio grande terraza cajas aire,Casa en arriendo,barranquilla,17142.85714285714
4500000,"loma de bernal, rosales, simesa",8.0,6.0,1.0,135.0,casa arriendo ubicada sector 70 cerca parque conservación cerca belén parque cuneta 135 metros cuenta 7 habitaciones 4 baños sala comedor cocina integral zona ropas sirve hospedaje turístico estudiantil amoblado costo 4500000 amoblar 3800000 código 44710356 asesor danirley hincapie,Casa en arriendo,bogota,33333.333333333336
6000000,"laureles, acacias, rosales",11.0,4.0,2.0,220.0,inmuebles sujetos verificación disponibilidad gas x pipeta 1 baño sencillo 1 baño cabinado vidrio templado alarmas camaras seguridad iluminacion led sensores humo patio descubierto cocina semi integral,Casa en arriendo,medellin,27272.727272727272
4500000,"laureles, conquistadores, acacias",7.0,5.0,1.0,220.0,arriendo casa laureles fácil acceso cerca centros comerciales zona rosa laureles excelentes vías transporte cerca centros educativos excelente familias numerosas multifamiliares garaje 7 amplias habitaciones respectivos closet 5 baños buena aireación encuentra edificio ubicada segundo piso,Casa en arriendo,medellin,20454.545454545456
4500000,"julio florez, metropolis, estrada",10.0,4.0,0.0,320.0,arrienda amplia casa consta 2 niveles 1 nivel 6 alcobas closet 2 baños 2 cocinas 2 patios 2 nivel 5 alcobas sala comedor 2 cocinas 2 baños zonas lavandería ilumina amplia cuenta 2 contadores gas solo luz agua cerca avenida 68 espaldas metrópolis actualmente encuentra habitada según requerimiento desocupa mes puede ser opcional oficinas microempresas,Casa en arriendo,desconocida,14062.5
6500000,"chapinero , samper, marly",11.0,4.0,3.0,400.0,espectacular casa comercial esquinera patrimonio histórico cuenta tres niveles lindo altillo zona considerada alto impacto ideal desarrollar actividades comerciales general dudes contactarnos,Casa en arriendo,bogota,16250.0
8500000,"molinos , bella suiza, san patricio",14.0,15.0,11.0,400.0,espectacular casa uso residencial comercial ideal ips u oficinas espacios generosos luminosos permitirán tener sitio agradable ideal ambos usos además encuentra ubicada sector alta valorización tan solo minutos centro comercial santa barbara bancos restaurantes zona cuenta excelentes vías acceso carrera 7 pepe sierra fácil transporte contáctenos agende cita,Casa en arriendo,bogota,21250.0
16000000,"urbanizacion flora, brisas de alamos, ciudad alamos",22.0,18.0,0.0,1400.0,alquiler edificio 4 pisos dotado sede educativa cuenta uso suelo barrio calima cerca colegios sector comercial entrega semi amoblado dotado cámaras vigilancia cada piso sistema incendio luces led puntos conexión computadores distribuido siguiente manera 1er piso gran recepción 4 salones enfermería rectoría sala profesores sala reuniones salón contabilidad oficina pagos ventanilla vidrio seguridad caja cafetería cocineta deposito 4 baños 2 hombre 2 mujeres dos entradas 1 estudiantes administración 2do piso 7 salones 4 salones clases 1 salón profesores 1 salón reuniones biblioteca 1 oficina baños mujeres hombres 1 deposito 3er piso 6 salones dos informática puntos 25 computadores 3 salones clases salón reuniones oficina baños hombre mujeres deposito 4to piso 3 salones 1 oficina habitación simulación hospitalización gran salón reuniones adaptar salones baños hombre mujer deposito 5to piso,Edificio en arriendo,cali,11428.57142857143
4500000,"villa del rio, ensueno, madelena iii y iv",10.0,3.0,0.0,220.0,oportunidad única arrendar remodelación paredes pisos 11 habitaciones espaciosas luminosas perfectas descanso privacidad 3 baños cómodos funcionales garantizando confort ocupantes 2 cocinas ampliamente equipadas ideales preparar deliciosas comidas grupos casa siendo entregada completamente remodelada pintura nueva ajustes necesarios asegurar experiencia agradable moderna cod 3863,Apartamento en arriendo,bogota,20454.545454545456
5000000,"castropol, alejandria, simesa",9.0,4.0,1.0,300.0,casa comercial arrendamiento ubicada importante zona sector poblado cuenta área aprox ofrece amplios luminosos espacios ideales diversos tipos negocios consta 9 habitaciones 4 baños zona ropas sala zona labores cocineta balcón acabados alta calidad aportan elegancia confort distribución versátil excelente ubicación cercana avenida poblado permiten adaptarse múltiples necesidades comerciales información agendar visita dudes comunicarte líneas atención cliente,Casa en arriendo,cali,16666.666666666668
10500000,"esperanza , santa cecilia, normandia",9.0,6.0,4.0,500.0,espaciosa casa comercial ideal negocio oportunidad única establecer empresa ubicación estratégica impresionante casa comercial construidos área privada ofrece espacio versátil funcional adaptarse necesidades negocio características destacadas amplias oficinas 9 oficinas diseñadas fomentar productividad confort equipo salones multifuncionales 2 salones cada perfectos reuniones capacitaciones eventos corporativos comodidades 6 baños 2 salas recepción 1 depósito pequeño cocina integral equipada almacenamiento estacionamiento bodega espaciosa garaje además espacio 4 parqueaderos adicionales conectividad facilidades 3 escaleras ingreso interno conexión ducto cablear planta eléctrica ubicación estratégica ideal empresas buscan espacio amplio bien ubicado pierdas oportunidad contáctanos información agenda visita,Casa en arriendo,bogota,21000.0
9500000,"santa rosa de lima, colores, calasanz",9.0,7.0,1.0,498.0,arriendo amplia casa 2 niveles calasanz cuenta 9 habitaciones 7 baños patio garaje uso comercial vivienda construidos,Casa en arriendo,bogota,19076.305220883532
