precio,ubicacion,habitaciones,baños,parqueaderos,area,descripcion,tipo_propiedad,ciudad_final,precio_por_m2
3300000000,"envigado, loma del escobero, palmas",4.0,4.0,2.0,450.0,zonas tranquilas exclusivas retiro antioquia encuentra hermosa casa campestre lista ser hogar sueños impresionante vista panorámica cuenta área terreno perfecta aquellos buscan amplio espacio disfrutar naturaleza privacidad ofrece vida campestre construcción distribuidos sola planta casa cuenta diseño moderno elegante amplias luminosas habitaciones total 4 baños diseño exclusivo además cuenta cochera garaje capacidad 2 vehículos mayor comodidad seguridad interior encontrarás todas comodidades necesitas vida cómoda relajada armarios empotrados todas habitaciones podrás mantener orden aprovechar máximo espacio baños auxiliares baño habitación principal equipados mejores acabados accesorios alta calidad además cuenta bibliotecaestudio ideal trabajan casa amantes lectura cocina equipada electrodomésticos modernos cocina integral perfecta amantes gastronomía además cuenta comedor auxiliar compartir mejores momentos familia encontrarás despensa depósito almacenar alimentos objetos personales disfruta casa detalles lujo doble ventana piso cerámica mármol todas áreas creando ambiente elegante confortable además cuenta habitación servicio hall alcobas conecta todas habitaciones días relajación jacuzzi terrazas vista montaña lugar perfecto escapar estrés renovar energías entorno rodeado naturaleza cuenta acceso pavimentado árboles frutales dan,Casa campestre en venta,cali,7333333.333333333
350000000,"solares de morada vii y viii, br senderos de morada, solares de morada v y vi",2.0,3.0,2.0,100.0,hermosa casa castillo zona jamundí sur ciudad cali consta 2 niveles amplios espacios 2 habitaciones mas estudio puede hacer reformas garaje 2 carros sala amplia comedor vestier zona ropas piscina salón social muchas zonas verdes,Casa en venta,cali,3500000.0
1200000000,"calera, plazuela, alto de virgen",4.0,8.0,12.0,5127.0,expectacular casafinca campestre vía bogotá calera km 85 construidos tres alcobas todas bano estudio sala chimenea comedor cuarto servicio baño area bbq casa vigilancia parqueadero amplio bosque nativo extraordinaria vista,Casa campestre en venta,bogota,234055.00292568753
194000000,"loma del atravesado, palmas, mesa",3.0,1.0,,78.0,encantadora casa cuenta servicios completos incluyendo gas red cocina baño ofrece amplio balcón 3 acogedoras habitaciones salacomedor zona ropas cocina sencilla 1 clóset 1 baño casa encuentra perfectas condiciones conservación mantenimiento actualmemnte rentando contrato marzo 2024,Casa en venta,medellin,2487179.487179487
1290000000,"bogota, monaco, puente largo",4.0,3.0,2.0,445.0,,Casa en venta,bogota,2898876.404494382
170000000,"boston, buenos aires, miraflores",3.0,2.0,,75.0,casa 2 pisos independientes espacios grandes ambiente familiar negocio familia,Casa en venta,medellin,2266666.6666666665
700000000,"san pedro, san vicente, santa monica",7.0,8.0,2.0,359.7,casa ubicada barrio juanambú norte cali consta dos pisos independientes área total construida 359 área lote terreno 226 primer piso antejardín garaje sala comedor cocina 3 alcobas 2 baños completos hall zona oficio cuarto servicio baño segundo piso 3 cuartos 2 baños hall balcón precio 700000000 contáctanos información,Casa en venta,cali,1946066.1662496526
500000000,"barranquilla, recreo, san jose",3.0,5.0,3.0,200.0,ciudad barranquilla encuentra impresionante casa 3 habitaciones 5 baños closet cocina integral hall alcobas elegancia comodidad espacios amplios cada rincón sido cuidadosamente pensado brindar máximo confort 3 parqueaderos ofrecen conveniencia seguridad vehículos casa lugar perfecto aquellos buscan hogar combine estilo funcionalidad sofisticación solo lugar bienvenido nuevo hogar,Casa en venta,barranquilla,2500000.0
168000000,"espinal, br portal del bunde, caballero y gongora",3.0,4.0,2.0,94.0,casa dos pisos excelente área ubicación iluminación ventilación consta tres alcobas dos closet tres baños salacomedorestudio cocina semiintegral zona ropas patio garaje,Casa en venta,desconocida,1787234.0425531915
890000000,"porvenir, san antonio, rionegro",4.0,8.0,2.0,203.0,casa parcelación cerrada san antonio pereira – rionegro espacio podrás disfrutar excelente ubicación fácil acceso amplia variedad bienes servicios casa tipo dúplex podrás encontrar primer nivel amplia zona social prevista sala comedor baño social amplia cocina integral acceso patio interior espacio cielo abierto habitación zona ropas encerrada nivel encontraras parqueadero cubierto acceso segundo nivel encontraras amplio hall alcobas habitación principal balcón vista exterior cuenta baño vestier encontraras tercera habitación baño vestier balcón vista patio interior cuarta habitación propio baño unidad cuenta vigilancia 24 horas encuentra ubicado sector residencial fácil acceso rutas transporte amplia variedad bienes servicios quieres conocerlo conocer relación contáctame si quieres conocerlo,Casa en venta,pereira,4384236.45320197
350000000,"sector transito municipal, prados del , torres de confandi",4.0,2.0,1.0,155.0,preciosa casa remodelada primer piso horizontal excelentes acabados amplias sala comedor espacio independiente 2 patios internos estudio bodega aparte cuartos antejardin cocina buenos cajones fresca cuarto principal mezanine da total privacidad amplitud ubicación cerca grandes centros comerciales unico carrera vías acceso supermercados cerca sector residencial bonito visitela vivala,Casa en venta,desconocida,2258064.5161290322
480000000,"altos del prado, altos de riomar, altos del limon",4.0,3.0,1.0,136.0,casa dos niveles ideal familia busca comodidad confort primer nivel encontramos amplia salacomedor conecta resto vivienda además dispone baño social fácil acceso visitas estudio puede servir oficina área lecturan parte trasera gran patio perfecto actividades reuniones familiares incluye cuarto baño servicio brindando privacidad comodidad personal doméstico garaje privado proporciona espacio suficiente vehículo asegurando seguridad conveniencia estacionamiento segundo nivel casa encuentran cuatro habitaciones todas ventanas permiten entrada luz natural ventilación adecuada dos habitaciones comparten baño completo mientras fácil acceso baños piso casa ideal buscan hogar cómodo espacios amplios,Casa en venta,desconocida,3529411.7647058824
1150000000,"san lucas, balsos no.1, inmaculada",3.0,8.0,5.0,160.0,codigo 19536 casa ubicada envigado sector san lucasvalor administración 615700valor predial 1927600 semestralavaluo catastral 432436741hernosa casa ubicada sector avignon zona tranquila familiar cerca mall san lucas super bowling frutera mall distrito avignon zona privilegiada tranquilidad cercania casa cuenta espacios comodos 3 alcobas baño habitación servicio baño social estudio amplio cocina abierta parqueadero 4 carros patio gran jardin vista bosque pertenece conjunto residencial urbanizacion plana conformada 33 casas piscina turco juegos infantiles buen acceso vias principales permite facil conectividad envigado medellín oriento antioqueño,Casa en venta,medellin,7187500.0
900000000,"santa barbara occidental, chico , santa barbara",4.0,4.0,2.0,215.0,presentamos espectacular casa perfecta remodelar chico navarra ubicación ideal cuenta buenas vías acceso parques restaurantes necesitas día día acceso vehicular calle 109 embargo salida peatonal lado opuesto conjunto permitirá acceder directamente gran parque podrás disfrutar zonas verdes aprovechar hacer ejercicio aire libre conjunto cuenta seguridad 24 horas consta 8 casas ingresar descubrirás casa diseño tradicional buenos espacios cuenta varias áreas adicionales espacios habitaciones cuales podrás acomodar estudio hall televisión incluso gimnasio acuerdo necesidades gran oportunidad aquellos quieren remodelar gusto buscan lugar tranquilo seguro familiar vivir pide cita ven conocerla,Casa en venta,desconocida,4186046.511627907
800000000,"sopo, briceno, montana",5.0,4.0,0.0,253.0,casa rentable centro sopó excelente ubicación cuenta dos apartamentos dos locales bodega invima servicios publicos gas natural renta aprox 4500000 mes apt1 primer piso salacomedor dos habitaciones baño patio ropas apt2 segundo piso salacomedor tres habitaciones balcon baño patio ropas aceptan permutas,Casa en venta,medellin,3162055.3359683794
1500000000,"san lucas, balsos no.1, inmaculada",4.0,4.0,2.0,200.0,excelente casa arrendamiento venda unidad bien ubicada excelentes espacios zona verde acabados impecables disfrutar familia casa buscaste cuenta 3 alcobas 1 servicio 3 baños completos 1 social cocina integral abierta zona ropas sala comedor estudio sala tv terraza amplia 2 parqueaderos cubiertos 2 descubiertos urbanización cuenta gimnasio piscina salón social parque infantil,Casa en venta,desconocida,7500000.0
280000000,"boca grande, castillo grande, br san pedro",2.0,3.0,2.0,90.0,tv cable servicio internet porteria vigilancia,Casa en venta,bogota,3111111.111111111
250000000,"dosquebradas, campestre a, san nicolas",3.0,3.0,1.0,92.0,casa sector playa rica dosquebradas ubicada zona estratégica alta valorización casa ofrece comodidad accesibilidad cercanía importantes vías comercios ubicación privilegiada acceso avenida ferrocarril variante pollo cerca viaducto césar gaviria trujillo pocos minutos supermercados ara d1 super inter excelente servicio transporte público rutas busetas taxis características casa sala comedor amplios 3 habitaciones cómodas cocina funcional zona ropas 2 baños completos 1 baño social contáctanos información agenda visita hoy mismo dejes pasar oportunidad inversión,Casa en venta,desconocida,2717391.304347826
680000000,"manizales, laureles, palermo bajo",3.0,3.0,1.0,111.81,ofrecemos espaciosa casa ubicación privilegiada rodeada vistas panorámicas distribuida 3 niveles ofrece mucha comodidad independencia 111 mtrs2 cuentas 3 habitaciones principal baño vestier balcón estudio patio grande pérgola zona ropas aparte cocina integral parqueadero vehículo exterior ventaja vivir conjunto cerrado cuentas vigilancia privada 24 horas áreas verdes privacidad exclusividad ubicación ideal 3 cuadras avenida santander cerca supermercados centro comercial universidades colegios pierdas oportunidad adquirir excelente casa ofrecemos espaciosa casa ubicación privilegiada rodeada vistas panorámicas distribuida 3 niveles ofrece mucha comodidad independencia 111 mtrs2 cuentas 3 habitaciones principal baño vestier balcón estudio patio grande pérgola zona ropas aparte cocina integral parqueadero vehículo exterior ventaja vivir conjunto cerrado cuentas vigilancia privada 24 horas áreas verdes privacidad exclusividad ubicación ideal 3 cuadras avenida santander cerca supermercados centro comercial universidades colegios pierdas oportunidad adquirir excelente casa,Casa en venta,manizales,6081745.818799749
180000000,"centro , centro, saleciano",6.0,2.0,0.0,180.0,casa asoagrin tuluá valle cauca piso 1 consta salacomedor 3 alcobas principal baño cocina baño social patio luz patio zona oficios piso 2 salacomedor 3 alcobas cocina baño social zona oficios terraza cerca polideportivo asoagrin,Casa en venta,medellin,1000000.0
235000000,"soacha, san luis, . terreros",3.0,2.0,1.0,62.0,excelente ubicacioncerca centro comercial gran plaza mercurio autopista sur bomberos estacion policia frente estadio soacha,Apartamento en venta,medellin,3790322.580645161
4500000000,"finca a venta, sector don diego palomino, catorce hectareas, cultivos de limon mandarino reforestacion de arboles de caoba con registro ica y arboles de otras maderas preciosas piscina de agua salada y paneles solares kiosko zona de asados bodegas casa de mayordomo plantas electricas de emergencia suplencia total pozo profundo con energia solar, a borde de via principal. cuenta con registro nacional de turismo, posee vivero para arboles forestales con registro ica.",1.0,,,1.0,,Finca en venta,desconocida,
250000000,"cali, junin, eucaristico",3.0,2.0,0.0,61.0,apartamento barrio selva apartamento tercer piso ascensor ventanal grande vista exterior cll 14 consta tres habitaciones 2 closet habitación principal baño privado baño social sala comedor cocina integral remodelada zona oficios terraza parqueadero comunitario estrato 3 unidad cuenta vigilancia 24 horas cuenta parques sociales cercanos cerca centros comerciales palmetto limonar plaza almacenes cadena olímpica ara d1,Apartamento en venta,cali,4098360.655737705
850000000,"balsos no.1, inmaculada, diamante no.2",3.0,3.0,2.0,145.0,presentamos magnífico apartamento situado mejores zonas medellín antioquia ubicación privilegiada ofrece estilo vida único rodeado comodidades servicios área total apartamento cuenta distribución inteligente aprovecha máximo espacio amplia área terreno igual medida área construida privada garantiza confort privacidad buscas además 3 alcobas 3 baños ofrecen suficiente espacio acomodar toda familia recibir invitados comodidad porteria solo diurna ingresar apartamento encontrarás construcción alta calidad detalles reflejan buen gusto elegancia hermoso suelo cerámica mármol pasando puerta seguridad clósets empotrados cocina acabados impecables baños remodelados estilo moderno ofrece comodidades facilidades podrás resistir cuenta baño auxiliar baño habitación principal bibliotecaestudio despensa zona lavandería habitación servicio además podrás disfrutar hermosa vista balcón ubicación complejo residencial cerrado zonas verdes quebrada cercana conectará naturaleza si buscas entretenimiento conveniencia apartamento cumple expectativas cercanía centros comerciales supermercados servicios facilitará vida ciudad tranquilidad acceso pavimentado ascensor porteríarecepción 247 brindarán seguridad necesitas,Apartamento en venta,medellin,5862068.9655172415
280000000,"centro, mejoras publicas, antonia santos centro",2.0,2.0,1.0,56.0,mj grupo inmobiliario excelente apartamento estrenar barrio san francisco edificio bocheti consta 2 habitaciones closet 2 baños sala comedor cocina integral zona ropas amplia,Apartamento en venta,medellin,5000000.0
300000000,"santo tomas, guarne, centro",0.0,0.0,0.0,2957.0,bienvenido aguaclara oasis tranquilidad hermosa vereda honda guarne presentamos proyecto lotes redefine experiencia vivir armonía naturaleza idílico rincón paz calma entrelazan ofrecerte entorno único puedes construir casa sueños ubicados paraíso natural lotes brindan oportunidad diseñar construir residencia siempre imaginado imagina despertar cada mañana canto pájaros disfrutar serenidad solo vereda honda puede ofrecer 5 lotes disponibles lote 2 encontrado dueño aún oportunidad elegir restantes lote 1 540000000 lote 3 570000000 lote 4 590000000 lote 5 300000000 cada lote puerta abierta realización sueños dimensiones generosas ubicación estratégica construye hogar refugio natural cada atardecer recordará,Lote en venta,pasto,101454.17653026716
1900000000,"ceja, ofir, fatima",4.0,3.0,1.0,213.89,finca municipio ceja situada vereda tranquila rodeada naturaleza cerca parque principal cuenta hermoso lago casa sola planta excelente lugar seguro apacible ideal disfrutar serenidad entorno,Finca en venta,desconocida,8883070.737294871
445000000,"entre amigos, sabaneta, vegas de doctora",2.0,2.0,1.0,60.0,cuadra parque principal sabaneta cerca droguerias farmacias restaurantes colegios transporte etc,Apartamento en venta,medellin,7416666.666666667
2400000,"ditaires, santa catalina, ferreria",,,0.0,29.0,posiciona negocio local 2860 m ubicado prestigioso mall portal estrella,Local Comercial en arriendo o venta,medellin,82758.62068965517
350000000,"centro, itagui, zona rural",2.0,2.0,1.0,61.0,apartamento cuenta pisos cerámica dan apariencia elegante moderna además tranquilidad tener propio parqueadero privado cuarto util comodidad seguridad ubicado zona segura conveniente fácil acceso necesites dejes pasar oportunidad única vivir apartamento excepcional contáctanos hoy información programar visita,Apartamento en venta,medellin,5737704.918032787
300000000,"galan, americas, igualdad",3.0,2.0,1.0,67.0,acogedor apto tres habitaciones dos baños amplia cocina integral sala comedor garaje cubierto apto excelente ingreso luz natural vista exterior occidente ciudad ubicado edificio ph cerca cc plaza américas parque mundo aventura ubicación estratégica av kra sesenta ocho av boyacá cerca av primero mayo rutas buses alimentadores tm cerca,Apartamento en venta,bogota,4477611.940298508
198000000,"lili, cali, ciudad real",2.0,2.0,0.0,60.0,apartamento sur cali sector ciudad meléndez ubicado valle lili cr ambar,Apartamento en venta,cali,3300000.0
780000000,"chico , chico , chico",3.0,3.0,2.0,144.0,exclusivo apartamento rincón chicó vista exterior ubicado prestigioso sector espectacular apartamento ofrece comodidad elegancia mejores zonas ciudad situado segundo piso cuenta agradable vista exterior espacios amplios bien iluminados dispone tres habitaciones además habitación servicio dos baños completos mas baño social estudio ideal trabajar casa pequeño balcón aporta espacio acogedor disfrutar aire libre apartamento incluye dos garajes brindando comodidad seguridad residentes edificio ofrece excelentes amenidades salón social jardines portería vigilancia 24 7 garantizando tranquilidad seguridad momento pierdas oportunidad vivir zonas exclusivas ciudad contáctanos información agendar visita,Apartamento en venta,desconocida,5416666.666666667
820000000,"chico , chico , santa barbara",3.0,4.0,1.0,152.0,hermoso apartamento amplia terraza privada rincón chicó ubicado exclusivo sector espectacular apartamento primer piso ofrece combinación perfecta confort amplitud ubicación privilegiada área total 152 cuenta tres habitaciones tres baños mas habitación servicio baño distribución funcional acogedora ideal buscan hogar espacioso mejores zonas ciudad mayores atractivos terraza privada 45 gracias cubierta deslizante permite disfrutar luz natural ventilación cualquier momento día además apartamento dispone garaje área construida 107 ubicación inmejorable cerca centros comerciales transporte público servicios salud vías principales garantiza comodidad fácil movilidad oportunidad única vivir estilo tranquilidad,Apartamento en venta,desconocida,5394736.842105263
300000000,"cabanita, zona industrial no. 1, cabana",1.0,2.0,1.0,47.0,espectacular apartamento ubicado barrio san josé obrero ciudad bello cuenta 1 habitaciones 2 baños 1 parqueaderos área construida 47 estrato 4,Apartamento en venta,medellin,6382978.723404256
340000000,"pino, gualanday, aldea verde",3.0,2.0,2.0,72.0,bienvenido oportunidad única vivir estilo comodidad impresionante apartamento encuentra exclusiva unidad residencial todas necesidades deseos vuelven realidad aquí características hacen verdadero tesoro,Apartamento en venta,desconocida,4722222.222222222
450000000,"ciudadela del , a.s.d., navarra",3.0,2.0,1.0,88.0,hermoso apartamento cuenta luminoso salóncomedor podrás disfrutar reuniones amigos familiares,Apartamento en venta,medellin,5113636.363636363
1300000000,"castropol, tesoro, simesa",4.0,4.0,2.0,150.0,,Apartamento en venta,desconocida,8666666.666666666
10200000,"candelaria, conquistadores, villanueva",3.0,4.0,3.0,200.0,,Apartamento en arriendo,bogota,51000.0
4300000,"candelaria, conquistadores, villanueva",2.0,4.0,3.0,88.0,excelente apartamento ubicado loma encierro facilidad acceso avenida palmas avenida poblado además cerca centro comercial premium plaza carulla palmas palms avenue palma grande,Apartamento en arriendo,medellin,48863.63636363636
5000000,"candelaria, conquistadores, villanueva",2.0,2.0,2.0,83.0,apartamento ubicado sector castropol lugar tranquilo seguro facilidad acceso debido buena ubicación facilidad acceso palmas ambos,Apartamento en arriendo,bogota,60240.96385542169
4100000,"castropol, simesa, poblado",3.0,2.0,3.0,78.0,apartamento excelente ubicación piso 15 buenos acabados cuenta 2 parqueaderos 1 cuarto útil admón incluida,Apartamento en arriendo,medellin,52564.10256410256
6000000,"candelaria, conquistadores, villanueva",3.0,4.0,3.0,148.0,apartamento ubicado sector san lucas cuenta facilidad acceso rutas servicio público además cerca complex superior supermercados vaquita mall san lucas club campestre mall drive in supermercados olímpica,Apartamento en arriendo,bogota,40540.54054054054
9800000,"candelaria, conquistadores, villanueva",3.0,4.0,3.0,200.0,area 200mt aproximadamente 3 alcobas alcoba servio baño 3 baños 1 cuaro util unidad completa parqueadero 2 lineal asensores picina zonas humendas cancha square turcosauna mil agradables juegos infantiles senderos ecologicos balcon amplio,Apartamento en arriendo,medellin,49000.0
9500000,"tesoro, alejandria, castropol",3.0,4.0,4.0,280.0,apartamento arriendo ubicado sector poblado loma parra 3 alcobas 3 baños 3 parqueaderos cubierto unidad cuenta,Apartamento en arriendo,medellin,33928.57142857143
9400000,"candelaria, conquistadores, villanueva",2.0,4.0,3.0,85.0,apartamento ubicado sector linares cuenta facilidad acceso rutas servicio público debido buena ubicación además cerca centro comercial oviedo complex superior centro comercial santa fe,Apartamento en arriendo,medellin,110588.23529411765
18000000,"alejandria, poblado, patio bonito",7.0,5.0,2.0,260.0,hermoso penthouse excelente ubicacion unidad cerrada 7 cuartos 5 baños 2 cuartos util 2 parqueaderos sala comedor terraza vista milla oro cuenta 260m codigo inmbuele,Apartamento en arriendo,medellin,69230.76923076923
10000000,"castropol, tesoro, alejandria",2.0,4.0,3.0,166.0,apartamento amoblado arriendo ubicado sector pobladocastropol 2 alcobas 3 baños parqueadero doble cubierto unidad cuenta,Apartamento en arriendo,medellin,60240.96385542169
6400000,"candelaria, conquistadores, villanueva",3.0,4.0,3.0,130.0,apartamento ubicado sector castropol lugar tranquilo seguro facilidad acceso debido buena ubicación usado buen facilidad acceso palmas ambos,Apartamento en arriendo,bogota,49230.769230769234
7300000,"candelaria, conquistadores, villanueva",2.0,2.0,2.0,80.0,apartamento ubicado sector loma tesoro cuenta facilidad acceso rutas servicio público además cerca centro comercial tesoro mall clínica rosario fácil acceso avenida palmas loma tesoro,Apartamento en arriendo,medellin,91250.0
10500000,"castropol, tesoro, alejandria",2.0,4.0,3.0,160.0,apartamento amoblado arriendo unidad cerrada facil acceso principal aprox cuatro cuadras supermercados ubicado calle tranquila piso marmol puerta seguridad sala comedor estudio tv 2 alcobas baño cada cocina integral abierta tipo americano alcoba baño servicio balcon parqueaderos lineales cubiertos piscina gym salon social sauna parque infantil cancha squash zonas verdes vigilancia 24 horas citofonia circuito cerrado tv inmuebles sujetos verificación disponibilidad,Apartamento en arriendo,medellin,65625.0
7200000,"candelaria, conquistadores, villanueva",2.0,4.0,3.0,156.0,apartamento ubicado sector lomas cuenta facilidad acceso avenida palmas cerca centro comercial tesoro centro comercial vizcaya centro comercial tesoro mall mall verona mall piazza bella mall pinar rio,Apartamento en arriendo,medellin,46153.846153846156
1800000000,"niza suba, monaco, potosi",6.0,6.0,7.0,384.75,descubre nuevo hogar colina campestre hermosa casa 384 ubicada tranquilo seguro barrio mónaco suba bogotá opción perfecta buscan comodidad funcionalidad excelente entorno vivir 6 habitaciones amplias llenas luz natural gracias orientación norte 6 baños máxima comodidad familia visitas 7 espacios parqueo ideal necesitan espacio adicional vehículos encuentra ubicación estratégica excelentes conexiones transporte facilita día día precio atractivo costos adicionales aceptamos bancos hacer compra experiencia fácil sorpresas dejes pasar oportunidad hazla empieza vivir hogar mereces ✨ contáctanos detalles,Casa en venta,bogota,4678362.573099415
650000000,"laureles, loma de bernal, rosales",4.0,4.0,2.0,183.0,presentamos confortable casa ubicada palmas medellín lugar estratégico ciudad cerca centro comercial molinos cancha altavista parte baja cancha belén zafra parque belén metrosalud unidad hospitalaria belén universidad medellín necesitas bienestar contáctanos déjanos tener privilegio ayudarte encontrar lugar ideal,Casa en venta,medellin,3551912.568306011
180000000,"campo alegre, pantanos, a.s.d.",3.0,1.0,0.0,57.0,,Casa en venta,bogota,3157894.736842105
758000000,"chico , chico , santa bibiana",3.0,6.0,2.0,188.94,presentamos confortable casa ubicada barrio castellana lugar estratégico ciudad cuenta sala comedor cocina estudio 4 baños 3 habitaciones patio garaje cercana centros comerciales colegios universidades hospitales parques necesitas bienestar contáctanos déjanos tener privilegio ayudarte encontrar lugar ideal,Casa en venta,bogota,4011855.6155393245
