precio,ubicacion,habitaciones,baños,parqueaderos,area,descripcion,tipo_propiedad,ciudad_final,precio_por_m2
770000000,"santa barbara occidental, bogota, san patricio",4.0,3.0,2.0,160.0,alhambra encuentra amplia iluminada casa 4 habitaciones 3 baños grandes espacios invitan compartir familia mientras dos parqueaderos garantizan comodidad residentes ubicación privilegiada arquitectura moderna fundo refugio tranquilidad medio ajetreo urbano oportunidad única aquellos buscan hogar combine comodidad funcionalidad cada detalle,Casa en venta,bogota,4812500.0
320000000,"flores, . sabana de tibabuyes, villa elisa",5.0,3.0,1.0,120.0,casa esquinera bien ubicada sector residencial distribuida siguiente manera primer nivel,Casa en venta,bogota,2666666.6666666665
1990000000,"bogota, guaymaral, urd duraznillo y pimiento",3.0,7.0,9.0,360.0,magnifica conjunto cerrado excelente seguridad magníficos acabados zonas verdes nivel moderno casa buenos espacios distribución parqueaderos pérgola sector tranquilo fácil acceso facilidad transporte rodeada naturaleza,Casa en venta,bogota,5527777.777777778
4700000000,"bogota, ciudad jardin , iberia",4.0,4.0,7.0,500.0,ofrecemos hermosa casa ubicada suba mejores zonas campestres bogotá total 4 habitaciones ideal familias buscan espacio comodidad cuenta amplia cocina perfecta preparar deliciosas comidas familia además cuenta terraza balcón podrás disfrutar hermosas vistas ciudad montañas zona bbq independiente cubierta verde casa encuentra conjunto residencial ofrece amplia gama amenidades incluyendo generador respaldo áreas comunes cancha tenis zona juegos infantiles salón comunal además seguridad garantizada 24 horas día interior encontrarás características calentador agua gas chimenea gas ascensor privado mayor comodidad cuenta 5 parqueaderos individuales 2 parqueaderos línea contáctanos agendar visita esperamos,Casa en venta,bogota,9400000.0
730000000,"plan, casa blanca suba, suba urbano",9.0,7.0,0.0,112.68,gran oportunidad inversión casa 3 niveles distribuidos así sótano 1 apartamento 2 habitaciones sala comedor 1 baño cocina apartaestudio 1 habitación 1 baño cocina zona lavandería externa primer piso consta apartaestudio 1 habitación 1 baño cocina local baño zona ropas segundo piso consta 1 apartamento 2 habitaciones sala comedor 1 baño cocina zona ropas apartaestudio 1 habitación 1 baño cocina tercer piso 1 apartamento 2 habitaciones sala comedor 1 baño cocina terraza aplica permuta máximo 2 horas bogotá,Casa en venta,bogota,6478523.25168619
166000000,"salitre , tibabuyes, suba urbano",2.0,1.0,,44.0,casa barrio pinar fontana area consta dos alcobas baño sala comedor cocina basica pisos baldosa conjunto cerrado buena iluminacion cercana centro comercial hospital suba plancha construir tercera habitacion,Casa en venta,bogota,3772727.272727273
1890000000,"bogota, puente largo, julio florez",4.0,13.0,5.0,390.0,bella casa esquinera barrio pontevedra área construida dos pisos cuatro parqueaderos cubiertos totalmente remodelada sistema video portero cerca eléctrica perimetral puerta garaje motorizadas sistema hidroflow alta presión primer piso sala comedor recibidor baño social depósito bajo escalera jardin perimetral cocina integral patio cubierto depósito parqueadero cuarto baño servicio zona ropas segundo piso amplio estudio balcón exterior gym tres habitaciones baño privado habitación principal walking closet baño terraza bbq área veinte aprox,Casa en venta,bogota,4846153.846153846
890000000,"bogota, monaco, puente largo",5.0,3.0,2.0,367.0,niza antiguaclasica acogedora casa duplex 367 mccuenta sala comedor independientes agradable chimenea cocina comedor auxiliar cuarto baño servicio 2 baños sociales cinco cómodas habitaciones principal baño privadohermoso patio interior lavandería jardín garaje dobleubicada zona tranquila calle cerrada cerca parques todas comodidades sector,Casa en venta,bogota,2425068.1198910084
750000000,"niza suba, monaco, potosi",4.0,3.0,0.0,128.25,rentahouse acogedora casa barrio tradicional bogota amplios espacios buena distribucion patio privadoclosets madera,Casa en venta,bogota,5847953.216374269
300000000,"nueva zelandia, villa del prado, vervenal",4.0,2.0,1.0,66.0,casa ubicada localidad suba barrio mirandela conjunto residencial quintas san pedro v construidos distribuidos 3 niveles 4 habitaciones 2 baños sala comedor habitación principal balcón parqueadero privado independiente descubierto pisos cerámica cocina integral independiente junto zona ropas estufa gas 3 puestos cercar avenidas principales av boyacá calle 183 autopista norte cercano zona comercial supermercados centro comercial santa fe transporte público cercano portal norte colegios zonas verdes cod 3857,Casa en venta,cali,4545454.545454546
1700000000,"bogota, potosi, monaco",4.0,3.0,2.0,330.0,espectacular casa dúplex terraza cuenta cuatro habitaciones estudio tv sala comedor cocina integral zona ropas cuarto baño servicio deposito dos parqueaderos cuenta seguridad privada zonas verdes,Casa en venta,bogota,5151515.151515151
2700000000,"santa barbara occidental, san patricio, santa bibiana",4.0,4.0,5.0,288.0,presentamos espectacular casa cuenta buena distribución espacios amplios iluminados únicos perfectos comodidad hogar lugar ofrece tranquilidad vivir día día familia amigos cuenta gran jardín tomar respiro disfrutar aire libre ubicada zona central bogotá diferentes vías acceso zonas comerciales harán vivir acá mas fácil casa lista nuevo comienzo pierdas gran oportunidad contáctanos planear visita casa,Casa en venta,bogota,9375000.0
940000000,"bogota, puente largo, julio florez",5.0,4.0,4.0,198.0,pontevedra casa remodelada aproximadamente área construida 7m frente 28 fondo área total 1er piso ambiente sala ambiente comedor estudio cocina baño social zona lavado cubierta cuarto servicio baño patio aire libre 2 do piso,Casa en venta,bogota,4747474.747474748
1800000,"santa teresita, bellavista, granada",1.0,1.0,0.0,38.0,arrienda apartaestudio tres ambientes acabados modernos buen gusto cocina integral mesón porcelanato carpintería calidad espacio lavadora cerrado servicio citofonía incluye energía acueducto gas domiciliario cuenta calentador zonas comunes cuenta terraza vista hacia cerro tres cruces belalcazar cristales sitio tranquilo barrio san antonio aprovecha oportunidad agenda cita,Apartamento en arriendo,cali,47368.42105263158
4000000,"chico , chico , chico",1.0,2.0,1.0,60.0,acogedor apartamento cabrera excelente ubicación comodidades ubicado exclusivo sector cabrera pocos pasos parque virrey hermoso apartamento 60 m cuadrados ofrece combinación perfecta comodidad estilo ubicación privilegiada cuenta amplia habitación principal ideal valoran espacio tranquilidad además dos baños sala comedor luminosa acogedora parqueadero privado apartamento encuentra sexto piso moderno edificio ofrece ascensor panorámico brindando vistas agradables acceso cómodo zona destaca cercanía parques zonas comerciales restaurantes excelentes vías acceso carrera 11 carrera 15 calle 85 además contar rutas transporte público cercanas excelente opción buscan vivir zonas cotizadas bogotá,Apartamento en arriendo,bogota,66666.66666666667
1000000,"normandia occidental, normandia, estrada",1.0,1.0,1.0,25.0,1052460 apartaestudio amoblado arriendo barrio real engativá apartamento área alcoba 1 baño 1 cocina integral 1 zona ropas 1 arrienda apartaestudio amoblado excelentes acabados buena iluminación natural cuenta 1 alcoba closet 1 baño cocina integral zona ropas sala comedor ubicado 3 piso ascensor esperamos brindarte asesoría pronto consigas nuevo hogar manera fácil rápida contáctanos buscas código 1052460,Apartaestudio en arriendo,bogota,40000.0
2200000,"san jose, alpes, angeles",1.0,2.0,2.0,54.0,apartaestudio arriendo unidad cerrada buena ubicación pinares cerca avenida principal supermercados cadena centros comerciales clinicas rutas transporte publico servicios complementarios cuenta salacomedor pisos porcelanato habitacion dos baños estufa calentador gas cocina integral meson quarztone zona ropas unidad cuenta piscina gimnasio salon comunal saunaturco parques infantiles zonas verdes parqueadero cubierto vigilancia porteria 24 horas inmuebles sujetos verificación disponibilidad,Apartamento en arriendo,desconocida,40740.74074074074
5860000,"castropol, alejandria, simesa",1.0,2.0,2.0,52.0,apartamento ubicado sector ciudad rio cerca centro comercial premium plaza centro automotriz cuenta facilidad acceso avenida poblado avenida vegas regional además cerca supermercados estación industriales,Apartamento en arriendo,medellin,112692.30769230769
2200000,"veracruz, samper, catedral",1.0,1.0,1.0,39.0,apartamento amoblado arriendo centro bogotá barrio nieves aledaños barrios aguas candelaria capuchina san diego veracruz acceso vías principales avenida jiménez avenida calle 19 avenida calle real avenida carrera 3 avenida carrera 10 pocos minutos centro histórico parque periodistas museo oro casa museo quinta bolívar universidad central universidad andes universidad jorge tadeo lozano universidad andes diagonal centro comercial angeles áreas sociales terraza mascotas lavandería dos salas estudio salón salón juegos salón cine salón reuniones salón fiestas terraza salón comunal gimnasio,Apartamento en arriendo,bogota,56410.256410256414
1386000,"bogota, santa barbara occidental, san patricio",1.0,1.0,1.0,31.0,gusto presentar apartamento ubicado norte ciudad alhambra cuenta habitación baño ducha eléctrica sala comedor cocina integral eléctrica zona lavandería pisos madera laminada deposito garaje cubierto ubicación brindará excelentes vías acceso facilidad transporte público cerca vías principales pepe sierra centro comercial autopista,Apartamento en arriendo,bogota,44709.67741935484
2700000,"entre amigos, sabaneta, vegas de doctora",1.0,2.0,2.0,70.0,encuentra nuevo hogar amplio apartaestudio estrenar corazón sabaneta ubicado exclusivo barrio parque pasos colegios centros comerciales mayorca aves marías transporte público estación metro sabaneta ofrecemos acogedor apartaestudio aproximados todas comodidades amplia luminosa alcoba amplio vestier baño dará privacidad necesitas salacomedor espacio ideal recibir visitas disfrutar delicioso momento familia cocina integral equipada torre hornos campana calentador permitirá preparar exquisitos platos además cuenta amplio patio ropas edificio ascensor comodidad apartamento encuentra piso 7 unidad cerrada portero 24 horas acabados porcelanato acabados lujo dan toque moderno elegante esperes exclusivo apartaestudio corazón sabaneta nuevo hoga,Apartaestudio en arriendo,medellin,38571.42857142857
700000,"san pedro, santa teresita, san vicente",1.0,1.0,0.0,40.0,si buscando comodidad confort excelente ubicación opción perfecta apartaestudio ambiente ubicado barrio centenario ofrece necesitas disfrutar estilo vida práctico situado segundo piso cuenta cocina semiintegral habitación cómoda además dispone práctica zona oficios lavadero ropa luz independiente servicio agua gas seria compartido mejor ubicación estratégica vía principal solo dos cuadras centro comercial centenario cerca lugares icónicos instituto bellas artes plazoleta jairo varela podrás disfrutar actividades culturales entretenimiento además acceso rápido transporte público dejes pasar gran oportunidad vivir sectores tranquilos contáctanos agenda cita conocer increíble apartaestudio,Apartaestudio en arriendo,bogota,17500.0
1200000,"laureles, acacias, lorena",1.0,1.0,0.0,30.0,codigo wasi aparta estudio alcoba independiente sector simón bolívar alcoba cuenta closet sala comedor baño cabinado acrilico bien ubicado facíl salida vias principales san juan avenida 80 buenas rutas transporte segundo piso ascensor asesor jeffferson alcaraz,Apartamento en arriendo,medellin,40000.0
2900000,"castropol, simesa, poblado",1.0,2.0,2.0,55.0,,Apartamento en arriendo,medellin,52727.27272727273
2900000,"chico , chico , chico",1.0,2.0,2.0,75.0,vive encanto luminoso apartamento amoblado primer piso elevado corazón bogotá 1 habitación2 terrazas sala comedor estudio chimenea 2 baños vista interior 1 parqueadero edificio inteligente bienvenido nuevo hogar comodidad diversión encuentran cada rincón,Apartamento en arriendo,bogota,38666.666666666664
1550000,"chapinero , samper, marly",1.0,1.0,1.0,34.0,chapinero ofrecemos apartaestudio 34mc moderno edificio centrika séptimo piso exterior sala comedor agradable vista balcón apto cuenta cocina moderna abierta horno gas barra central pisos laminados madera acabados modernos cuarto vista baño edificio vigilancia permanente garaje ubicado zona estratégica pasos universidad javeriana cerca parques comercios vías principales todas comodidades sector,Apartaestudio en arriendo,bogota,45588.23529411765
4000000,"tesoro, alejandria, florida",1.0,2.0,1.0,67.0,apartamento arrendar poblado moderno completamente terminado parqueadero cuarto útil sola torre cerca centro comercial tesoro santa fé,Apartamento en arriendo,medellin,59701.49253731343
1670000,"redil, toberin, nueva zelandia",1.0,1.0,1.0,42.0,arr id houm 148751 entérate beneficios arrendar • asistencia intermediación propietario • firma contrato online • arrienda burocracia papeleos notarías departamento arriendo ubicado barrio san antonio noroccidental superficie construida 42 superficie total 42 principales características • amoblado • 1 dormitorio • 1 baño • admite mascotas • 1 parqueadero • año construcción 2024 • bodega si arriendas brindamos asesoría personalizada proceso requisitos arrendar • arrienda codeudor fácil rápido seguro • demuestra ingreso mensual neto menos 25 veces valor arriendo ingresos mensuales pueden complementar personas vivirán • completa información básica mándanos extractos bancarios documentos demuestren ingresos • debes tener reportes negativos centrales crédito importante • invitamos agendar visita • si alguna duda favor puedes solicitar información portales contactarte directamente houm aplican tc,Apartamento en arriendo,bogota,39761.90476190476
2160000,"mesa, zona centro, inmaculada",1.0,2.0,1.0,62.0,mayor información escribanos vía whatsapp agentes inmobiliarios atenderá arrendamos apartaestudio envigado loma brujas buen servicio transporte público cerca centro comercial city plaza hospital manuel uribe angel distribuida sala comedor cocina integral zona ropas balcón habitacion dos baños parqueadero,Apartamento en arriendo,medellin,34838.709677419356
4500000,"alejandria, patio bonito, diamante no.2",1.0,2.0,1.0,65.0,apartamento amoblado duplex arriendo medellin sector sta m angeles excelente apartamento amoblado duplex construidos distribuidos 1 habitación 2 baños closet balcón unidad cerrada parqueadero juegos infantiles excelente ubicación cómodas rutas acceso codigo m,Apartamento en arriendo,medellin,69230.76923076923
4700000,"tesoro, alejandria, florida",1.0,2.0,2.0,82.0,apartamento arriendo unidad cerrada cerca supermercados restaurantes universidades colegios centros comerciales sector tranquilo cercano gran variedad servicios complementarios piso madera puerta seguridad sala comedor independiente 1 alcoba baño privado baño social cocina integral abierta tipo americano terraza parqueadero cubierto edificio ascensor piscina gym salon comunal turco sauna parques infantiles zonas verdes vigilancia 24 hrs citofonia circuito cerrado tv inmuebles sujetos verificación disponibilidad,Apartamento en arriendo,desconocida,57317.07317073171
2150000,"laureles, castellana, acacias",1.0,1.0,1.0,50.0,excelente aparta estudio arriendo sector laureles segundo piso 50 mtrs apx 1 habitación sala comedor cocina integral zona ropas 1 baño cuenta excelentes acabados moderno iluminado edificio video citófono ascensor excelente ubicación zona tranquila residencial cerca éxito laureles av 80 av san juan gracias interés inmuebles raskcielos usted ofertas inmobiliarias contáctenos través pbx aparece inicio publicación asesores atenderá acompañará búsqueda,Apartaestudio en arriendo,medellin,43000.0
1350000,"boston, bombona no.1, asomadera no.2",1.0,1.0,0.0,45.0,acogedor apartaestudio 2 ambientes ubicado buenos aires cuenta 1 habitación independiente vestier closet cocina sencilla baño zona ropas balcón edificio cerrado vigilancia portería 247 servicios incluidos energía agua max 2 personas,Apartaestudio en arriendo,medellin,30000.0
4200000,"castropol, poblado, san diego",2.0,2.0,1.0,65.0,apartamento arriendo medellín sector poblado excelente apartamento contruidos distribuidos 2 habitaciónes 2 baños vestier closet cocina integral balcòn parqueadero salacomedor zona ropas cuarto util excelentes acabamos unidad cerrada conpiscina sauna turco gimnasio jeugos infantiles cancha multiple salòn social excelente ubicación cómodas rutas acceso codigo,Apartamento en arriendo,medellin,64615.38461538462
1300000,"villa del rio, madelena iii y iv, venecia",2.0,1.0,0.0,45.0,1052 apartamento arriendo ed san marcos venecia apartamento área alcobas 2 baños 1 cocina integral 1 zona lavandería 1 apto arriendo 46 metro cuadrados ubicado edificio barrio venecia estrato 3 consta 2 habitaciones 1 baño sala comedor cocina integral zona lavandería independiente ascensor avenidas principales cerca autopista sur av boyacá unas cuadras estación transmilenio venecia cerca centro comercial paseo villa rio valor canon incluye administración queremos ayudarte puedas encontrar nuevo hogar contáctanos buscas,Apartamento en arriendo,medellin,28888.88888888889
2600000,"normandia occidental, esperanza, modelia occidental",2.0,1.0,0.0,90.0,1052516 casa arriendo cr villa pinar mz 72 fontibón casa área alcobas 2 baños 15 cocina integral 1 zona lavandería 1 garaje 1 descubierto casa arriendo ubicada conjunto residencial barrio santa cecilia fontibón estrato 4 consta 2 habitaciones 15 baños sala comedor cocina integral zona lavandería independiente avenidas principales cerca av cali av dorado cerca centro comercial hayuelos valor canon incluye administración queremos ayudarte puedas encontrar nuevo hogar contáctanos buscas,Casa en arriendo,cali,28888.88888888889
4750000,"cartagena, daniel lemaitre, canapote",2.0,2.0,1.0,106.0,disfruta comodidad lujo moderno apartamento completamenbte amoblado excelentes acabados vista privilegiada ciudad parte mar hogar ideal buscan confort exclusividad ubicación estratégica crespo cerca aeropuerto playas zona turística cartagena,Apartamento en arriendo,cartagena,44811.32075471698
4000000,"envigado, esmeraldal, loma del atravesado",2.0,2.0,2.0,83.0,apartamento arriendo envigado sector colina campestre area 83 metros 2 habitaciones 2 baños sala comedor vestier closet cocina zona ropas parqueadero cuarto util zonas sociales mas opciones visita pagina wwwgruporespaldoinmobiliariocom,Apartamento en arriendo,medellin,48192.77108433735
1200000,"villa del rio, ensueno, madelena iii y iv",2.0,1.0,0.0,41.0,1052518 – apartamento arriendo cr estancia 70 club residencial madelena apartamento área 41 mts² alcobas 2 baños 1 cocina integral 1 zona lavandería 1 apartamento arriendo ubicado conjunto residencial barrio madelena – ciudad bolívar estrato 3 consta 2 habitaciones 1 baño sala comedor cocina integral zona lavandería avenidas principales cerca autopista sur av villavicencio frente club madelena cafam estación transmilenio perdomo,Apartamento en arriendo,villavicencio,29268.29268292683
1250000,"lili, caney, ciudad real",2.0,2.0,1.0,52.0,ofrece renta magnífico apartamento estrenar conjunto residencial rioja ubicado próspero barrio valle lili zona constante crecimiento alta valorización encantador hogar encuentra estratégicamente situado cerca transporte público parques centros comerciales supermercados universidades ubicado segundo piso accesible mediante ascensor apartamento ofrece generosa superficie construida 57 distribución diseñada maximizar luminosidad comodidad acogedora salacomedor integra armoniosamente moderna cocina abierta amplio balcón puede disfrutar vista serena refrescante parque encuentra justo enfrente ofreciendo oasis tranquilidad conexión naturaleza además hogar cuenta práctica zona oficios independiente habitación auxiliar closet baño social versátil espacio puede ser utilizado estudio sala tv habitación principal igualmente confortable dispone propio baño closet baños sido elegantemente revestidos enchape lujo agregando toque sofisticación cada detalle conjunto residencial ofrece comodidades parqueadero propio piscinas áreas juegos infantiles zona social zona bbq pierdas oportunidad conocer hermoso apartamento agenda cita cuanto descubre próximo hogar,Apartamento en arriendo,desconocida,24038.46153846154
1900000,"entre amigos, vegas de doctora, vegas de san jose",2.0,2.0,1.0,55.0,apartamento arriendo ubicado sabaneta vereda san josé consta 2 habitaciones clóset 2 baños cabinados salacomedor cocina integral zona ropas balcón parqueadero portería 24 horas ascensores situado zona campestre rodeada naturaleza vía principal loma san josé pocos minutos colegio school business acceso rutas integradas metro vista hacia piscinas reserva natural,Apartamento en arriendo,medellin,34545.454545454544
2500000,"entre amigos, sabaneta, tres esquinas",2.0,2.0,1.0,67.0,vive estilo comodidad caracteristicas principales cocina integral 2 habitaciones closet 2 banos sala comedor amplia espacio estudio red gas calentador parqueadero privado cuarto util zonas comunes lujo piscinas turco gimnasio cancha deportivas sendero ecologico juegos infantiles gimnasio porteria vigilancia 24 horas dejes pasar oportunidad unica,Apartamento en arriendo,medellin,37313.432835820895
1800000,"rionegro, gualanday, santa ana",2.0,2.0,0.0,52.0,codigo 26756 apartamento arriendo ubicado rionegro sector san antonio características inmueble✔ 2 habitaciones✔ habitación principal clóset✔ habitación auxiliar clóset✔ 2 baños modernos✔ salóncomedor amplio iluminado✔ cocina abierta integral excelente distribución✔ zona ropas independiente✔ balcón vista despejada zonas comunes✔ portería 24 horas✔ parque infantil zonas verdes✔ cancha deportiva✔ zona mascotas✔ parqueadero visitantes ubicación entornoubicado san antonio rionegro acceso rápido a✅ centro comercial san nicolás reserva plaza complex llanogrande✅ pocos minutos jardines llanogrande espacios verdes esparcimiento✅ fácil acceso hospital san vicente clínica somer hospital gilberto mejía✅ cercano supermercados éxito carulla jumbo d1✅ minutos sitios históricos iglesia san antonio pereira concatedral san nicolás apartamento ideal buscan comodidad tranquilidad ubicación estratégica contáctanos información agendar visita,Apartamento en arriendo,pereira,34615.38461538462
1800000,"calasanz, colores, calasanz parte alta",2.0,2.0,0.0,55.0,apartamento arriendo calazans cuenta 2 habitaciones calentador cocina integral 2 baños 2 closet estudio zona ropas cuenta zonas comunes piscina gimnasio zonas verdes cuenta fácil acceso transporte público si deseas información contáctanos,Apartamento en arriendo,medellin,32727.272727272728
3400000,"mesa, san lucas, inmaculada",2.0,2.0,1.0,70.0,apartamento arriendo esmeraldal buenos acabados excelente iluminación dispone dos habitaciones clóset vestier baños cabinados salacomedor cocina integral barra americana zona ropas balcón unidad ofrece portería 24 horas ascensor parqueaderos zonas comunes ubicado zona residencial tranquila frente club casa diana tiendas d1 cerca arenas chachas acceso rutas integradas metro,Apartamento en arriendo,desconocida,48571.42857142857
1800000,"rionegro, lotus i, gualanday",2.0,2.0,1.0,55.0,descripción 44712878 apartamento arriendo barrio porvenir apartamento aproximadamente ofrece diseño cómodo funcional cuenta 2 alcobas 2 baños sala comedor iluminada cocina integral moderna zona ropas independiente balcón vista agradable 2 clósets parqueadero común encuentra ubicado unidad cerrada ofrece portería 24 horas salón social juegos infantiles gimnasio cancha múltiple ascensor shut basuras ubicación estratégica permite fácil acceso rutas transporte además cercanía supermercados centros comerciales servicios esenciales código 12878,Apartamento en arriendo,medellin,32727.272727272728
2100000,"laureles, conquistadores, acacias",2.0,1.0,,48.0,hermoso apartamento exclusivo sector florida nueva pocos pasos estacion estadio metro moderno apartamento cuenta acabados contemporaneos ascensor encuentra ubicacion faciles vias acceso comodas rutas transporte publico llamanos mas informacion,Apartamento en arriendo,medellin,43750.0
1300000,"porvenir, centro, alto del medio",2.0,2.0,2.0,56.0,,Apartamento en arriendo,bogota,23214.285714285714
1200000,"altos del prado, prado, ciudad jardin",2.0,1.0,,55.0,,Apartamento en arriendo,desconocida,21818.18181818182
3550000,"san lucas, inmaculada, balsos no.1",2.0,2.0,2.0,78.0,apartamento arriendo unidad cerrada sector residencial tranquilo cerca centros comerciales colegios rutas transporte público supermercados piso ceramica sala comedor 2 alcobas baño principal cocina integral abierta tipo americano balcon parqueadero cubierto conjunto cerrado piscina gym salon social parque infantil cancha squash zonas verdes vigilancia 24 horas citofonía circuito cerrado tv inmuebles sujetos verificación disponibilidad,Apartamento en arriendo,desconocida,45512.820512820515
